{
  "country": "United States",
  "country_code": "US",
  "identifiers": {
    "composite_figi": "BBG000BS21R1",
    "cusip": "69181V107",
    "figi": "BBG000BS2CB4"
  },
  "industry": "Capital Markets",
  "industry_group": "Diversified Financials",
  "kind": "stock",
  "listings": [
    {
      "currency": "USD",
      "exchange_mic": "XNAS",
      "symbol": "OXSQ"
    }
  ],
  "market_cap_band": "Micro Cap",
  "name": "Oxford Square Capital Corp.",
  "primary_symbol": "OXSQ",
  "provenance": {
    "fetched_at": "2026-10-04T11:58:09Z",
    "license": "MIT",
    "source": "FinanceDatabase",
    "source_url": "https://github.com/JerBouma/FinanceDatabase"
  },
  "schema_version": "1.0.0",
  "sector": "Financials",
  "summary": "Oxford Square Capital Corp. is a business development company, operates as a closed-end, non-diversified management investment company. It is a private equity and mezzanine firm. The firm invests in both public and private companies. It invests in secured and unsecured senior debt, subordinated debt, junior subordinated debt, preferred stock, common stock and syndicated bank loans. The firm primarily invests in debt and/or equity securities of technology-related companies that operate in the computer software, Internet, information technology infrastructure and services, media, telecommunications and telecommunications equipment, semiconductors, hardware, technology-enabled services, semiconductor capital equipment, medical device technology, diversified technology, and networking systems sectors. It concentrates its investments in companies having annual revenues of less than $200 million and a market capitalization or enterprise value of less than $300 million. The firm invests between $5 million and $30 million per transaction. It seeks to exit its investments within 7 years. It serves as the investment adviser to TICC. Oxford Square Capital Corp., formerly known as TICC Capital Corp., was founded in 2003 and is headquartered in Greenwich, Connecticut.",
  "website": "http://www.ticc.com"
}
