{
  "country": "Thailand",
  "country_code": "TH",
  "identifiers": {
    "composite_figi": "BBG00HQ3MDN9",
    "figi": "BBG00HQ3MDP7",
    "isin": "TH8206010R13"
  },
  "industry": "Power Producers & Renewables",
  "industry_group": "Utilities",
  "isin": "TH8206010R13",
  "kind": "stock",
  "listings": [
    {
      "currency": "THB",
      "exchange_mic": "XBKK",
      "symbol": "SSP-R.BK"
    }
  ],
  "market_cap_band": "Micro Cap",
  "name": "Sermsang Power Corporation Public Company Limited",
  "primary_symbol": "SSP-R.BK",
  "provenance": {
    "fetched_at": "2026-10-18T10:36:51Z",
    "license": "MIT",
    "source": "FinanceDatabase",
    "source_url": "https://github.com/JerBouma/FinanceDatabase"
  },
  "schema_version": "1.0.0",
  "sector": "Utilities",
  "summary": "Sermsang Power Corporation Public Company Limited operates in the renewable energy business. The company produces electricity through solar farm and rooftop, and wind farm projects. It operates 7 solar farms and 7 solar rooftop projects of 194 MWp in Thailand, Japan, Vietnam, Mongolia, and Indonesia; and 1 wind farm in Vietnam. The company distributes its electricity to state and publicly traded utility corporations and industrial users. It also provides investment and consultancy services. The company was founded in 2010 and is based in Bangkok, Thailand.",
  "website": "http://www.sermsang.com"
}
