{
  "country": "Japan",
  "country_code": "JP",
  "industry": "Pharmaceuticals",
  "industry_group": "Pharmaceuticals, Biotechnology & Life Sciences",
  "kind": "stock",
  "listings": [
    {
      "currency": "JPY",
      "exchange_mic": "XJPX",
      "symbol": "4931.T"
    }
  ],
  "market_cap_band": "Small Cap",
  "name": "Shinnihonseiyaku Co., Ltd.",
  "primary_symbol": "4931.T",
  "provenance": {
    "fetched_at": "2026-10-04T11:58:09Z",
    "license": "MIT",
    "source": "FinanceDatabase",
    "source_url": "https://github.com/JerBouma/FinanceDatabase"
  },
  "schema_version": "1.0.0",
  "sector": "Health Care",
  "summary": "Shinnihonseiyaku Co., Ltd. provides cosmetics, pharmaceuticals, and health foods in Japan and internationally. It operates through Mail Order, Direct Store Sales/Wholesale, and Overseas Sales segments. The company provides skincare products under the Perfect One brand; and pharmaceutical products for various diseases and symptoms. It operates a network of 12 stores; and online shops. The company was formerly known as Shinnihonliving Co., Ltd. and changed its name to Shinnihonseiyaku Co., Ltd. in April 2002. Shinnihonseiyaku Co., Ltd. was founded in 1992 and is headquartered in Fukuoka City, Japan.",
  "website": "http://www.corporate.shinnihonseiyaku.co.jp/"
}
