{
  "country": "Australia",
  "country_code": "AU",
  "identifiers": {
    "composite_figi": "BBG00CJZ7HW5",
    "figi": "BBG00CJZ7HW5"
  },
  "industry": "Metals & Mining",
  "industry_group": "Materials",
  "kind": "stock",
  "listings": [
    {
      "currency": "USD",
      "exchange_mic": "OTCM",
      "symbol": "LMMFF"
    }
  ],
  "market_cap_band": "Micro Cap",
  "name": "Livium Ltd.",
  "primary_symbol": "LMMFF",
  "provenance": {
    "fetched_at": "2026-10-04T11:58:09Z",
    "license": "MIT",
    "source": "FinanceDatabase",
    "source_url": "https://github.com/JerBouma/FinanceDatabase"
  },
  "schema_version": "1.0.0",
  "sector": "Materials",
  "summary": "Lithium Australia NL primarily engages in the acquisition, exploration, and development of lithium properties. It operates through Tenement Exploration and Evaluation; and Processing Technology segments. The company holds interests in various projects located in Western Australia, Queensland, Northern Territory, and South Australia in Australia; Canada; and Germany. It also engages in the development of processing technology for lithium extraction; and battery material research and development activities. The company was formerly known as Cobre Montana NL and changed its name to Lithium Australia NL in July 2015. Lithium Australia NL was incorporated in 2007 and is based in West Perth, Australia.",
  "website": "http://lithium-au.com"
}
