{
  "country": "United Kingdom",
  "country_code": "GB",
  "identifiers": {
    "composite_figi": "BBG00B5YJBN5",
    "figi": "BBG00B5YJBN5",
    "isin": "GB00BNGDN821"
  },
  "industry": "Machinery",
  "industry_group": "Capital Goods",
  "isin": "GB00BNGDN821",
  "kind": "stock",
  "listings": [
    {
      "currency": "USD",
      "exchange_mic": "OTCM",
      "symbol": "MLSPF"
    },
    {
      "currency": "GBP",
      "exchange_mic": "XLON",
      "symbol": "MRO.L"
    }
  ],
  "market_cap_band": "Mid Cap",
  "name": "Melrose Industries PLC",
  "primary_symbol": "MLSPF",
  "provenance": {
    "fetched_at": "2026-10-11T12:21:30Z",
    "license": "MIT",
    "source": "FinanceDatabase",
    "source_url": "https://github.com/JerBouma/FinanceDatabase"
  },
  "schema_version": "1.0.0",
  "sector": "Industrials",
  "summary": "Melrose Industries PLC engages in the aerospace, automotive, powder metallurgy, air management, and other industrial businesses in the United Kingdom, rest of Europe, North America, and internationally. Its Aerospace segment provides airframe and engine structures, and electrical interconnection systems for the aerospace industry in civil airframe and defense platforms. The company's Automotive segment designs, develops, manufactures, and integrates driveline technologies; and epowertrains and intelligent all-wheel drive systems. Its Powder Metallurgy segment offers precision automotive components and components for industrial and consumer applications; metal powder for powder metallurgy; and additive manufacturing parts for prototypes. The company's Nortek Air Management segment manufactures and sells ventilation products for the professional remodeling and replacement, residential new construction, and consumer DIY markets. This segment also manufactures and sells split-system and packaged air conditioners, heat pumps, furnaces, air handlers, and parts for the residential replacement and new construction markets; and custom designed and engineered products and systems for non-residential applications. Its Other Industrial segment provides turbo generators, transformers, and switchgears; develops and manufactures security, home automation, and access control technologies for the residential and commercial markets; and designs, manufactures, and distributes ergonomic products for use in a various working, learning, and healthcare environments. The company was formerly known as New Melrose Industries PLC and changed its name to Melrose Industries PLC in November 2015. Melrose Industries PLC was founded in 2003 and is headquartered in London, the United Kingdom.",
  "website": "http://www.melroseplc.net"
}
