{
  "country": "China",
  "country_code": "CN",
  "identifiers": {
    "composite_figi": "BBG00X700ND4",
    "cusip": "09950L302",
    "figi": "BBG00X700ND4"
  },
  "industry": "Specialty Retail",
  "industry_group": "Retailing",
  "kind": "stock",
  "listings": [
    {
      "currency": "USD",
      "exchange_mic": "XNYS",
      "symbol": "BQ"
    }
  ],
  "market_cap_band": "Nano Cap",
  "name": "Boqii Holding Limited",
  "primary_symbol": "BQ",
  "provenance": {
    "fetched_at": "2026-10-04T11:58:09Z",
    "license": "MIT",
    "source": "FinanceDatabase",
    "source_url": "https://github.com/JerBouma/FinanceDatabase"
  },
  "schema_version": "1.0.0",
  "sector": "Consumer Discretionary",
  "summary": "Boqii Holding Limited operates a pet-focused platform in the People's Republic of China. The company offers food, treats, shampoos, cages, toys, apparel, OTC veterinary drugs, and other pet products to pet parents, and small and medium pet businesses through e-commerce platforms and offline distribution network. It also operates Boqii Community, an interactive content platform; and provides online marketing and information services. The company was founded in 2008 and is headquartered in Shanghai, the People's Republic of China.",
  "website": "http://www.boqii.com"
}
