{
  "country": "United States",
  "country_code": "US",
  "industry": "Oil, Gas & Fuels",
  "industry_group": "Energy Production & Services",
  "kind": "stock",
  "listings": [
    {
      "currency": "EUR",
      "exchange_mic": "XBER",
      "symbol": "PG81.BE"
    }
  ],
  "name": "PLAINS GP HLDGF LP UTS A",
  "primary_symbol": "PG81.BE",
  "provenance": {
    "fetched_at": "2026-10-18T10:36:51Z",
    "license": "MIT",
    "source": "FinanceDatabase",
    "source_url": "https://github.com/JerBouma/FinanceDatabase"
  },
  "schema_version": "1.0.0",
  "sector": "Energy",
  "summary": "Plains GP Holdings, L.P. is a publicly traded limited partnership that owns an interest in Plains All American Pipeline, L.P. Plains All American Pipeline, L.P. engages in the transportation, storage, and gathering of crude oil and natural gas liquids. Plains GP Holdings is based in Houston, Texas."
}
