{
  "country": "Japan",
  "country_code": "JP",
  "industry": "Chemicals",
  "industry_group": "Materials",
  "kind": "stock",
  "listings": [
    {
      "currency": "JPY",
      "exchange_mic": "XJPX",
      "symbol": "4366.T"
    }
  ],
  "market_cap_band": "Micro Cap",
  "name": "Daito Chemix Corporation",
  "primary_symbol": "4366.T",
  "provenance": {
    "fetched_at": "2026-10-04T11:58:09Z",
    "license": "MIT",
    "source": "FinanceDatabase",
    "source_url": "https://github.com/JerBouma/FinanceDatabase"
  },
  "schema_version": "1.0.0",
  "sector": "Materials",
  "summary": "Daito Chemix Corporation manufactures and sells specialty and fine chemicals in Japan. The company offers photosensitive materials for LCD and semiconductor production. It also provides printing and photographic materials, functional dyes, pharmaceutical intermediates, and other chemical products. The company was founded in 1938 and is headquartered in Osaka, Japan.",
  "website": "http://www.daitochemix.co.jp"
}
