{
  "country": "United States",
  "country_code": "US",
  "industry": "Capital Markets",
  "industry_group": "Investing, Lending & Payments",
  "kind": "stock",
  "listings": [
    {
      "currency": "USD",
      "exchange_mic": "XNAS",
      "symbol": "MAYA"
    }
  ],
  "market_cap_band": "Nano Cap",
  "name": "Maywood Acquisition Corp.",
  "primary_symbol": "MAYA",
  "provenance": {
    "fetched_at": "2026-10-18T10:36:51Z",
    "license": "MIT",
    "source": "FinanceDatabase",
    "source_url": "https://github.com/JerBouma/FinanceDatabase"
  },
  "schema_version": "1.0.0",
  "sector": "Financials"
}
