{
  "country": "United States",
  "country_code": "US",
  "identifiers": {
    "composite_figi": "BBG01699JVG0",
    "cusip": "44852G309",
    "figi": "BBG01699JVG0"
  },
  "industry": "Health Care Providers & Services",
  "industry_group": "Health Care Equipment & Services",
  "kind": "stock",
  "listings": [
    {
      "currency": "USD",
      "exchange_mic": "XNAS",
      "symbol": "HWH"
    }
  ],
  "market_cap_band": "Nano Cap",
  "name": "HWH International Inc. Common Stock",
  "primary_symbol": "HWH",
  "provenance": {
    "fetched_at": "2026-10-11T12:21:30Z",
    "license": "MIT",
    "source": "FinanceDatabase",
    "source_url": "https://github.com/JerBouma/FinanceDatabase"
  },
  "schema_version": "1.0.0",
  "sector": "Health Care"
}
