{
  "country": "Canada",
  "country_code": "CA",
  "identifiers": {
    "composite_figi": "BBG000PRDZ46",
    "cusip": "29277Q107",
    "figi": "BBG000PRDZ46"
  },
  "industry": "Metals & Mining",
  "industry_group": "Materials",
  "kind": "stock",
  "listings": [
    {
      "currency": "USD",
      "exchange_mic": "OTCM",
      "symbol": "ENRT"
    }
  ],
  "market_cap_band": "Nano Cap",
  "name": "Enertopia Corp.",
  "primary_symbol": "ENRT",
  "provenance": {
    "fetched_at": "2026-10-04T11:58:09Z",
    "license": "MIT",
    "source": "FinanceDatabase",
    "source_url": "https://github.com/JerBouma/FinanceDatabase"
  },
  "schema_version": "1.0.0",
  "sector": "Materials",
  "summary": "Enertopia Corp., a development stage company, focuses on pursuing business opportunities in the natural resource sector in Canada. The company holds 100% interests in the lode and placer claims in Clayton Valley, Nevada. Its technology is used to recover and extract battery grade lithium carbonate powder from brine solutions. The company was formerly known as Golden Aria Corp. and changed its name to Enertopia Corp. in February 2010. Enertopia Corp. was founded in 2004 and is headquartered in Kelowna, Canada.",
  "website": "http://www.enertopia.com"
}
