{
  "country": "Germany",
  "country_code": "DE",
  "identifiers": {
    "composite_figi": "BBG000HFW7F0",
    "figi": "BBG000HFWBV3"
  },
  "industry": "Airlines",
  "industry_group": "Transportation",
  "kind": "stock",
  "listings": [
    {
      "currency": "EUR",
      "exchange_mic": "XMUN",
      "symbol": "AB1.MU"
    }
  ],
  "market_cap_band": "Nano Cap",
  "name": "Air Berlin PLC",
  "primary_symbol": "AB1.MU",
  "provenance": {
    "fetched_at": "2026-10-11T12:21:30Z",
    "license": "MIT",
    "source": "FinanceDatabase",
    "source_url": "https://github.com/JerBouma/FinanceDatabase"
  },
  "schema_version": "1.0.0",
  "sector": "Industrials",
  "summary": "Air Berlin PLC, together with its subsidiaries, provides airline services in Germany and internationally. Air Berlin PLC was incorporated in 2005 and is headquartered in Berlin, Germany. As of August, 2015, Air Berlin PLC is in reorganization.",
  "website": "http://www.airberlin.com"
}
