{
  "country": "Austria",
  "country_code": "AT",
  "identifiers": {
    "isin": "AT0000A2ABL1"
  },
  "isin": "AT0000A2ABL1",
  "kind": "stock",
  "listings": [
    {
      "currency": "EUR",
      "exchange_mic": "XWBO",
      "symbol": "AT0000A2ABL1.VI"
    }
  ],
  "name": "EGB OE TS.Z./BEIERSDORF",
  "primary_symbol": "AT0000A2ABL1.VI",
  "provenance": {
    "fetched_at": "2026-05-24T08:15:25Z",
    "license": "MIT",
    "source": "FinanceDatabase",
    "source_url": "https://github.com/JerBouma/FinanceDatabase"
  },
  "schema_version": "1.0.0"
}
