{
  "country": "United States",
  "country_code": "US",
  "industry": "Internet & Direct Marketing Retail",
  "industry_group": "Retailing",
  "kind": "stock",
  "listings": [
    {
      "currency": "USD",
      "exchange_mic": "XNAS",
      "symbol": "QVCG"
    }
  ],
  "market_cap_band": "Micro Cap",
  "name": "QVC Group Inc. Common Stock",
  "primary_symbol": "QVCG",
  "provenance": {
    "fetched_at": "2026-09-27T11:41:05Z",
    "license": "MIT",
    "source": "FinanceDatabase",
    "source_url": "https://github.com/JerBouma/FinanceDatabase"
  },
  "schema_version": "1.0.0",
  "sector": "Consumer Discretionary"
}
