{
  "industry_group": "Banks",
  "kind": "stock",
  "listings": [
    {
      "currency": "EUR",
      "exchange_mic": "XMUN",
      "symbol": "XS182934542.MU"
    }
  ],
  "name": "OP-ASUNTOLUOTTOP.18/25MTN",
  "primary_symbol": "XS182934542.MU",
  "provenance": {
    "fetched_at": "2026-10-04T11:58:09Z",
    "license": "MIT",
    "source": "FinanceDatabase",
    "source_url": "https://github.com/JerBouma/FinanceDatabase"
  },
  "schema_version": "1.0.0",
  "sector": "Financials"
}
