{
  "country": "Saudi Arabia",
  "country_code": "SA",
  "identifiers": {
    "composite_figi": "BBG01BN26GR3",
    "figi": "BBG01BN2B154",
    "isin": "SA15LI2KL814"
  },
  "industry": "Chemicals",
  "industry_group": "Materials",
  "isin": "SA15LI2KL814",
  "kind": "stock",
  "listings": [
    {
      "currency": "SAR",
      "exchange_mic": "XSAU",
      "symbol": "9552.SR"
    }
  ],
  "market_cap_band": "Micro Cap",
  "name": "Saudi Top Trading Co.",
  "primary_symbol": "9552.SR",
  "provenance": {
    "fetched_at": "2026-10-11T12:21:30Z",
    "license": "MIT",
    "source": "FinanceDatabase",
    "source_url": "https://github.com/JerBouma/FinanceDatabase"
  },
  "schema_version": "1.0.0",
  "sector": "Materials",
  "summary": "Saudi Top Trading Co. operates within the Kingdom of Saudi Arabia, specializing in the production and distribution of various plastic raw materials. The company's extensive product portfolio encompasses polyethylene wax, polyethylene, polyethylene terephthalate, thermoplastic elastomers, styrenics, polypropylene, rubber, and engineering polymers, in addition to plastic films and bags. These materials are integral to numerous sectors, finding applications in adhesives, road marking paints, masterbatch and filler masterbatch, petroleum wax blends, PVC and PVC compounds, rubber manufacturing, and printing ink industries. Established in 2006, the firm maintains its headquarters in Riyadh, Saudi Arabia.",
  "website": "https://stp.com.sa"
}
