{
  "country": "Austria",
  "country_code": "AT",
  "identifiers": {
    "figi": "BBG00V7KRXR8",
    "isin": "AT0000A2H6M7"
  },
  "isin": "AT0000A2H6M7",
  "kind": "debt",
  "listings": [
    {
      "currency": "EUR",
      "exchange_mic": "XWBO",
      "symbol": "AT0000A2H6M7.VI"
    }
  ],
  "name": "EGB OE TL.Z./RWE",
  "primary_symbol": "AT0000A2H6M7.VI",
  "provenance": {
    "fetched_at": "2026-10-04T11:58:09Z",
    "license": "MIT",
    "source": "FinanceDatabase",
    "source_url": "https://github.com/JerBouma/FinanceDatabase"
  },
  "schema_version": "1.0.0",
  "summary": "RWE AG is a German multinational energy company headquartered in Essen. It is one of the leading electricity and gas companies in Europe, generating power from conventional and renewable sources. RWE operates power plants, trades in energy, and provides energy-related services to customers."
}
