{
  "country": "Sweden",
  "country_code": "SE",
  "identifiers": {
    "composite_figi": "BBG007354KN5",
    "figi": "BBG007354KV6"
  },
  "industry_group": "Materials",
  "kind": "stock",
  "listings": [
    {
      "currency": "EUR",
      "exchange_mic": "XBER",
      "symbol": "SCA1.BE"
    }
  ],
  "name": "SVENSKA CELL.A FR.SK 3,33",
  "primary_symbol": "SCA1.BE",
  "provenance": {
    "fetched_at": "2026-10-04T11:58:09Z",
    "license": "MIT",
    "source": "FinanceDatabase",
    "source_url": "https://github.com/JerBouma/FinanceDatabase"
  },
  "schema_version": "1.0.0",
  "sector": "Materials",
  "summary": "Svenska Cellulosa AB (SCA) is a Swedish forest industry company. SCA manufactures and sells forest products, including pulp, paper, packaging, wood products, and renewable energy. The company is headquartered in Sundsvall, Sweden."
}
