{
  "country": "Russian Federation",
  "country_code": "RU",
  "identifiers": {
    "composite_figi": "BBG000DBD6F6",
    "figi": "BBG000DBD6F6",
    "isin": "RU000A0DKZK3"
  },
  "industry": "Electric Utilities",
  "industry_group": "Utilities",
  "isin": "RU000A0DKZK3",
  "kind": "stock",
  "listings": [
    {
      "currency": "RUB",
      "exchange_mic": "MISX",
      "symbol": "KLSB.ME"
    }
  ],
  "market_cap_band": "Nano Cap",
  "name": "Kaluga Power Sale Company Public Joint-Stock Company",
  "primary_symbol": "KLSB.ME",
  "provenance": {
    "fetched_at": "2026-10-11T12:21:30Z",
    "license": "MIT",
    "source": "FinanceDatabase",
    "source_url": "https://github.com/JerBouma/FinanceDatabase"
  },
  "schema_version": "1.0.0",
  "sector": "Utilities",
  "summary": "Kaluga Power Sale Company Public Joint-Stock Company engages in the production, wholesale, and retail of electrical energy in the Kaluga region, Russia. It operates a gas turbine plant that has an installed capacity of approximately 20.8 MW of electricity and 49.88 Gcal/h thermal energy. The company was founded in 2004 and is based in Kaluga, Russia. Kaluga Power Sale Company Public Joint-Stock Company operates as a subsidiary of Kaluzhskaya gorodskaya energeticheskaya kompaniya OAO.",
  "website": "http://www.ksc.kaluga.ru"
}
