{
  "country": "Austria",
  "country_code": "AT",
  "identifiers": {
    "figi": "BBG00YG03BX3",
    "isin": "AT0000A2M5Q3"
  },
  "isin": "AT0000A2M5Q3",
  "kind": "stock",
  "listings": [
    {
      "currency": "EUR",
      "exchange_mic": "XWBO",
      "symbol": "AT0000A2M5Q3.VI"
    }
  ],
  "name": "RCB Disc.Z./ATX 20-21",
  "primary_symbol": "AT0000A2M5Q3.VI",
  "provenance": {
    "fetched_at": "2026-05-31T08:33:31Z",
    "license": "MIT",
    "source": "FinanceDatabase",
    "source_url": "https://github.com/JerBouma/FinanceDatabase"
  },
  "schema_version": "1.0.0"
}
