{
  "country": "Germany",
  "country_code": "DE",
  "identifiers": {
    "composite_figi": "BBG007R9H3V6",
    "figi": "BBG007R9H3X4",
    "isin": "DE0005419105"
  },
  "industry": "IT Services",
  "industry_group": "Software & IT Services",
  "isin": "DE0005419105",
  "kind": "stock",
  "listings": [
    {
      "currency": "EUR",
      "exchange_mic": "XLON",
      "symbol": "0O0F.IL"
    },
    {
      "currency": "USD",
      "exchange_mic": "OTCM",
      "symbol": "CCCMF"
    },
    {
      "currency": "EUR",
      "exchange_mic": "XBER",
      "symbol": "COK.BE"
    },
    {
      "currency": "EUR",
      "exchange_mic": "XETR",
      "symbol": "COK.DE"
    },
    {
      "currency": "EUR",
      "exchange_mic": "XDUS",
      "symbol": "COK.DU"
    },
    {
      "currency": "EUR",
      "exchange_mic": "XFRA",
      "symbol": "COK.F"
    },
    {
      "currency": "EUR",
      "exchange_mic": "XHAN",
      "symbol": "COK.HA"
    },
    {
      "currency": "EUR",
      "exchange_mic": "XHAM",
      "symbol": "COK.HM"
    },
    {
      "currency": "EUR",
      "exchange_mic": "XMUN",
      "symbol": "COK.MU"
    },
    {
      "currency": "EUR",
      "exchange_mic": "XSTU",
      "symbol": "COK.SG"
    },
    {
      "currency": "EUR",
      "exchange_mic": "XWBO",
      "symbol": "COK.VI"
    }
  ],
  "market_cap_band": "Small Cap",
  "name": "Cancom SE",
  "primary_symbol": "0O0F.IL",
  "provenance": {
    "fetched_at": "2026-10-18T10:36:51Z",
    "license": "MIT",
    "source": "FinanceDatabase",
    "source_url": "https://github.com/JerBouma/FinanceDatabase"
  },
  "schema_version": "1.0.0",
  "sector": "Information Technology",
  "summary": "CANCOM SE is a German IT solutions provider, offering consulting, implementation, and managed services for businesses. The company focuses on cloud computing, IT infrastructure, and cybersecurity solutions. Its headquarters are located in Munich, Germany.",
  "website": "http://www.cancom.de"
}
