{
  "country": "Hong Kong",
  "country_code": "HK",
  "identifiers": {
    "composite_figi": "BBG00CCKW919",
    "figi": "BBG00CCKW928",
    "isin": "KYG3037S1021"
  },
  "industry": "Health Care Providers & Services",
  "industry_group": "Health Care Equipment & Services",
  "isin": "KYG3037S1021",
  "kind": "stock",
  "listings": [
    {
      "currency": "HKD",
      "exchange_mic": "XHKG",
      "symbol": "2138.HK"
    },
    {
      "currency": "USD",
      "exchange_mic": "OTCM",
      "symbol": "UNHLF"
    }
  ],
  "market_cap_band": "Micro Cap",
  "name": "EC Healthcare",
  "primary_symbol": "2138.HK",
  "provenance": {
    "fetched_at": "2026-10-11T12:21:30Z",
    "license": "MIT",
    "source": "FinanceDatabase",
    "source_url": "https://github.com/JerBouma/FinanceDatabase"
  },
  "schema_version": "1.0.0",
  "sector": "Health Care",
  "summary": "EC Healthcare is an investment holding firm headquartered in Mong Kok, Hong Kong, in operation since 2005, offering medical and healthcare services in Hong Kong, Macau and the mainland. It reports medical, aesthetic medical with beauty and wellness, and other segments, covering imaging, surgery, dentistry, hair restoration, chiropractic and veterinary care. Brands include PRODERMA LAB and Swissline, and it was called Union Medical Healthcare Limited until April 2021.",
  "website": "https://www.echealthcare.com"
}
