{
  "country": "Austria",
  "country_code": "AT",
  "identifiers": {
    "figi": "BBG00P7VW7V3",
    "isin": "AT0000A289R5"
  },
  "isin": "AT0000A289R5",
  "kind": "stock",
  "listings": [
    {
      "currency": "EUR",
      "exchange_mic": "XWBO",
      "symbol": "AT0000A289R5.VI"
    }
  ],
  "name": "EGB OE TL.Z./VARTA",
  "primary_symbol": "AT0000A289R5.VI",
  "provenance": {
    "fetched_at": "2026-05-31T08:33:31Z",
    "license": "MIT",
    "source": "FinanceDatabase",
    "source_url": "https://github.com/JerBouma/FinanceDatabase"
  },
  "schema_version": "1.0.0"
}
