{
  "country": "United States",
  "country_code": "US",
  "identifiers": {
    "figi": "BBG000008J53"
  },
  "industry_group": "Diversified Financials",
  "kind": "stock",
  "listings": [
    {
      "currency": "USD",
      "exchange_mic": "XNYS",
      "symbol": "GJP"
    }
  ],
  "market_cap_band": "Nano Cap",
  "name": "STRATS Trust For Dominion Resources Inc. Securities, Series 2005-6",
  "primary_symbol": "GJP",
  "provenance": {
    "fetched_at": "2026-09-27T11:41:05Z",
    "license": "MIT",
    "source": "FinanceDatabase",
    "source_url": "https://github.com/JerBouma/FinanceDatabase"
  },
  "schema_version": "1.0.0",
  "sector": "Financials",
  "summary": "STRATS Trust For Dominion Resources Inc. Securities, Series 2005-6 is a unit investment trust holding securities related to Dominion Resources Inc., distributing income to its unitholders. It was formed in 2005 and is managed by a financial institution, focused on providing income from Dominion Resources securities."
}
